day,title,new_text
20230816,"5대은행, 수출기업 대상 5.4조원 대출상품 신설…금리 1.5%p↓"," 수출환어음 최대 1.7%p·신용장 수수료 0.7%p 감면…""고금리 부담 던다"" 5대 은행(KB국민·신한·우리·하나·NH농협)이 글로벌 경기 둔화, 고금리 등으로 어려움을 겪는 수출 기업을 지원하기 위해 5조4천억원 규모의 자체 우대상품을 마련했다. 발언하는 김주현 금융위원장 김주현 금융위원장이 10일 오전 서울 여의도 국회에서 열린 '수출 경쟁력 강화를 위한 수출금융 종합지원대책 민당정협의회'에서 발언하고 있다. 2023.8.10 금융위원회는 이러한 내용을 포함한 '수출금융 종합지원 방안'을 16일 발표했다. 금융당국은 수출기업 전용 우대상품을 마련할 수 있도록 올해 초부터 시중은행과 협의를 진행해왔다. 대출금리 1.5%p·보증료 0.8%p 우대…""수출기업 비용 경감"" 5대 은행은 보증기관(신용보증기금·기술보증기금)에 특별출연하거나 자체 여력을 활용해 5조4천억원 규모의 자체 상품을 내놨다. 대출금리는 최대 1.5%포인트(p)까지, 보증료는 0.8%포인트까지 우대한다. 은행별로 KB국민은행은 8천600억원을 추가로 공급한다. 대상 기업을 수출기업에서 잠재 수출기업으로 확대했고 완전 보증(보증비율 100%) 상품도 출시했다. 신한은행은 8천억원 규모의 우대상품을 취급한다. 금리는 최대 0.3%포인트, 보증료는 최대 0.5%포인트 내렸고 만기 자동연장 등 혜택이 추가됐다. 우리은행은 금리 최대 1.5%포인트, 보증료 최대 0.8%포인트를 인하해 1조5천억원 규모의 우대상품을 내놨다. 수출다변화기업, 동반진출 기업 등이 지원 대상으로 포함됐다. 하나은행은 1조5천억원을 추가 공급하고 금리는 최대 1.0%포인트, 보증료는 0.8%포인트 낮춘다. 수출실적이 없는 수출 준비 기업도 지원 대상으로 추가됐다. NH농협은행은 우대상품 추가공급 금액으로 6천억원을 마련했고 리쇼어링(해외 진출 기업의 국내 복귀) 기업도 대상 범위에 포함됐다. 수출기업들은 은행 우대상품으로 연간 약 500억원가량 이자·보증료를 절감할 수 있을 것으로 기대하고 있다. 고금리 여파로 무역비용 가중…수출환어음·신용장 부담 던다 고금리 등으로 수출기업의 무역 비용이 증가하자 수출환어음(수출기업이 수출채권을 담보로 수입업체를 대상으로 발행하는 어음) 할인율(외화조달금리+가산료율)을 인하하고 특별보증을 지원하는 내용도 지원방안에 포함됐다. 금융당국에 따르면 지난해 하반기 이후 글로벌 고금리가 지속되면서 수출환어음 할인율이 급등해 수출기업 부담이 가중된 상황이다. 은행은 수출환어음을 할인된 가격에 매입하고 수출업자에게 수출대금을 선지급하는데 할인율을 낮춰 수출기업의 비용 부담을 줄인다는 설명이다. 은행이 자체적으로 수출환어음을 매입하는 경우 할인율을 최대 1.5%포인트 인하한다. 은행별로 KB국민·신한·우리·하나은행은 1.5%포인트, NH농협은 1.2%포인트 낮춘다. 수출입은행이 재매입을 약정한 경우 KB국민·신한·우리·하나은행은 1.5%포인트에 수은 재매입금리 감면율(0.1∼0.2%포인트)을 더한 만큼 인하하고 NH농협은행은 1.2%포인트에 수은 감면율을 합산한 만큼 낮춘다. 아울러 중간재 조달 수출기업의 비용 부담을 완화하기 위해 신용장(수출기업이 추후에 수입대금을 결제할 수 있도록 은행이 보증하는 증서) 개설 수수료를 0.3∼0.7%포인트 내리고 최장 9개월이었던 개설 기간을 1년으로 늘리는 방안도 추진된다. 이 밖에 높은 선물환 수수료(기준환율 대비 2% 내외)로 수출기업이 환 헤지(hedge·위험 분산) 거래를 기피하자 선물환 계약 수수료를 최대 90% 우대하는 지원방안도 포함됐다. 금융위는 ""수출기업이 시중은행 무역금융을 이용하면서 발생하는 비용 부담을 완화해 자금상 어려움을 해소하고 수출 활동을 촉진하도록 하겠다""고 말했다. ▶제보는 카톡 okjebo 저작권자(c). 무단전재-재배포금지 "
20230816,"금융위원장 ""50년 만기 주택담보대출 급증...나이 제한 검토 중""","  50년 만기 주택담보대출이 최근 급증하면서 가계대출 증가 요인으로 지목되자 금융당국이 연령 제한을 검토하기로 했습니다. 김주현 금융위원장은 오늘(16일) '수출금융 종합지원 방안' 간담회 이후 기자들과 만나 초장기 주담대에 연령 제한을 두는 방법에 대해 ""공감하며 보고 있다""고 말했습니다. 이어 4월부터 주담대가 증가하고 있는데 어떤 연령대에서 어떤 목적으로 쓰고 있는지 종합적으로 본 뒤 어느 정도까지 용인할지 판단할 수 있다고 설명했습니다. 다만, 아직 규제와 관련해서는 결정된 방향이 없다고 선을 그었습니다. 김 위원장은 또, 가계부채 증가세에 대해 재정을 풀거나 부채로 소비를 유도하는 게 제일 쉬운 방법인데 결국 상환 문제가 남기 때문에 과도하게 부채가 늘어나는 건 좋지 않다고 지적했습니다. 다만 자산소득이 높지 않은 취약계층은 경기회복이 지연되면 연체율이 높아질 수밖에 없는데 갑자기 가계대출을 줄이면 또 어려워져 적정 수준에서 한도를 관리해야 한다고 강조했습니다. 앞서 금융당국은 50년 만기 주담대에 연령 제한을 도입할 경우 청년층 기준이 되는 만 34세 미만으로 한정하는 안을 검토하고 있는 것으로 알려졌습니다. 이번 달 들어 열흘 만에 주담대가 1조 원 이상 늘어나는 등 가계 대출 증가세가 이어지는 가운데, 초장기 주담대가 DSR 규제 우회 수단으로 활용되고 있다는 지적이 나오고 있기 때문입니다. YTN 엄윤주 () [카카오톡] YTN 검색해 채널 추가 [메일] [저작권자(c) YTN 무단전재 및 재배포 금지] "
20230816,"가계대출 증가세 위험신호‥금융당국 ""주담대 관련 은행 현장검검""","  [뉴스데스크] ◀ 앵커 ▶ 고금리가 계속되면서 대출 이자도 못 내는 사람들이 늘고 있는데요. 한편에서는 주택담보대출이 크게 늘고 있습니다. 가계대출이 사상 최대 수준으로 늘어나자, 금융당국이 대책 마련에 나섰습니다. 의 보도입니다. ◀ 리포트 ▶ 결혼을 앞둔 32살 김 모 씨는 신혼집 마련을 위해 지난주 특례보금자리론을 신청했습니다. 신청 액수는 최대치인 5억 원. [김 모 씨/직장인] ""소득 수준에 관계없이 LTV(주택담보대출비율)가 완화돼서 대출을 적용받을 수 있다는 점이 있어서 특례 보금자리론으로…"" 연 4.4%의 고정금리는 다른 상품보단 낮은 편이지만, 여전히 이자 부담이 만만치 않습니다. [김 모 씨/직장인] ""초반부에는 (월) 200(만 원) 한 중반 정도 그 정도 나가게 될 거예요. 열심히 벌어서 빨리 갚아야죠."" 최근 부동산 거래가 회복세를 보이면서 지난달 은행권 주택담보대출은 지난 3월 이후 5개월 연속 증가했습니다. 전체 가계대출 잔액도 지난달 말 1천 68조 원을 넘겨 사상 최대치를 기록했습니다. 반면 빚을 제때 갚지 못해 이자율을 조정하거나 상환 기한을 미루는 등 '채무조정'을 신청하는 사람도 크게 늘었습니다. 올 상반기 신용 회복 신청자 수는 9만 2천 명으로 지난해 전체 13만 8천여 명의 70%에 근접했습니다. 고금리가 지속되면서 이자도 못 내는 대규모 가계 부실이 우려되자, 금융당국이 현장점검에 나서기로 했습니다. 우선 총부채원리금상환비율, DSR 규제를 회피하는 수법으로 지적받고 있는 '50년 만기 주담대'에 대해 만 34살 미만만 가입 가능하도록 하는 방안을 검토하고 있습니다. [이복현/금융감독원장] ""소득에서 과도하게 그 범위가 넘어가는 지점이 있음에도 불구하고 DSR(총부채원리금상환비율) 모델을 만들었을 수도 있고… 40년, 50년 주담대가 지금 활성화되면서 점검해야 할 부분들이 있기 때문에…"" 주택담보대출에 적극적인 인터넷 은행에 대해선 소득심사에 문제가 없는지도 살펴보기로 했습니다. 다만, 주요 가계대출의 하나인 특례보금자리론은 고정금리 대출 확대라는 긍정적인 측면도 있어 필요하다고 봤습니다. MBC뉴스 고재민입니다. 영상취재: 조윤기, 이원석/ 영상편집: 민경태 MBC 뉴스는 24시간 여러분의 제보를 기다립니다. ▷ 전화 02-784-4000 ▷ 이메일 ▷ 카카오톡 @mbc제보 영상취재: 조윤기, 이원석/ 영상편집: 민경태 기사 원문 - https://imnews.imbc.com/replay/2023/nwdesk/article/6515093_36199.html [저작권자(c) MBC (https://imnews.imbc.com) 무단복제-재배포 금지] 저작권자(c) MBC (www.imnews.com) 무단복제-재배포 금지 "
20230816,"한은 대출제도 개편 이유…금통위 ""기존 제도, 뱅크런 지원 한계""","  이창용 한국은행 총재가 지난달 13일 서울 중구 한국은행에서 열린 금융통화위원회 본회의에 참석하고 있다. 한국은행 금융통화위원회 위원들이 한은의 기존 대출제도로는 '뱅크런(대규모 예금인출)' 우려가 있는 금융기관을 지원하는 데 한계가 있다고 평가한 것으로 나타났다. 16일 한은이 공개한 2023년 제14차 금통위 의사록에 따르면 금통위원들은 지난달 27일 열린 금통위 회의에서 ""미국 실리콘밸리은행(SVB) 사태 등을 계기로 디지털 뱅킹 환경하에서 대규모 예금인출 확산 가능성이 높아진 것으로 나타났다""며 이같이 평가했다. 앞서 한은 금통위는 지난달 27일 대출 제도 개편안을 의결했다. 새마을금고, 농협, 수협, 신협, 상호저축은행 등 비은행 예금취급기관에 대규모 예금인출 사태나 긴급한 자금조달 문제가 발생할 경우 한은이 신속히 유동성 지원에 나서는 내용이다. 대출적격담보증권 범위를 기존 국채와 통안채, 정부보증채, 신용증권, 주택저당증권(MBS), 특수은행채, 은행채 등에서 공사채, 지방채는 물론 적격 투자 등급(신용등급AA-이상)의 우량 회사채까지 넓히는 내용도 포함됐다. 이런 개편을 통해 한은은 유사시 은행은 90조원, 비은행 예금취급기관은 약 100조원의 유동성을 조달할 수 있을 거라고 설명한 바 있다. 금통위 의사록에는 한은이 이같은 제도 개편안을 마련한 이유가 설명돼 있다. 금통위원들은 ""현행 한은의 대출제도는 유동성 확보에 일시적으로 어려움을 겪는 예금취급기관에 대한 자금지원에 한계를 가지고 있다""며 ""특히 한은의 대출적격담보증권 범위가 주요국에 비해 좁게 설정돼 있고, 비은행예금 취급기관에 대한 지원에 있어선 상당한 제약이 있다""고 평가했다. 이에 금통위원들은 은행에 대한 낙인효과를 줄이고 한은 대출제도에 대한 접근성을 제고할 수 있도록 은행 상시 대출제도인 자금조정대출제도를 개편하는 것이 좋겠다는 의견을 표명했다. 또 금통위원들은 향후 금융시스템 내 유동성 리스크를 근본적으로 완화할 수 있는 대책으로, 주요국과 같이 대출적격담보에 예금취급기관의 대출채권을 추가하는 방안을 모색할 필요가 있다고 언급했다. 다만 비은행 예금취급기관의 경우에는 공동검사 및 자료제출 요구에 관한 제도 등의 여건이 갖춰진 이후 대출채권의 적격담보범위 포함 여부를 검토하는 것이 좋겠다는 의견을 냈다. 이외에도 금통위원들은 비은행 예금취급기관에 대한 대출 시 은행에 준하는 적격담보 범위를 적용하는 데 동의하면서, 한은이 이들 기관에 대한 신속한 유동성 지원 결정을 위해서는 감독당국과 정보공유가 보다 강화될 필요가 있다는 데 인식을 같이했다. <ⓒ경제를 보는 눈, 세계를 보는 창 무단전재 배포금지> "
20230816,반도체·2차전지 기업에 대출금리 최대 1.2%p 인하," 금융위, 23조원 규모 수출금융 지원책 발표  김주현 금융위원회 위원장을 비롯한 은행장들이 16일 오전 서울 중구 은행연합회에서 열린 수출금융 종합지원 방안 관련 간담회에서 기념 촬영을 하고 있다. 정부가 고금리와 글로벌 경기 부진으로 어려움을 겪는 국내 수출 기업들을 지원하기 위해 약 23조원 규모의 ‘수출금융 추가 지원책’을 16일 내놨다. 현재 시장 상황을 고려할 때 61조원인 기존의 수출금융 지원 규모가 부족하다고 판단해 추가 자금을 수혈하기로 한 것이다. 금융위원회는 이날 이 같은 내용이 담긴 ‘민관 합동 수출금융 종합지원 방안’을 발표했다. 추가 지원책은 크게 ‘수출 전략산업 지원(18조7000억원)’과 ‘신(新)수출 판로 개척 지원(4조1000억원)’으로 나뉜다. 전략산업 지원 부문에서는 반도체·2차전지(전기차 배터리)·바이오·원전 등 4대 핵심 분야에 대한 지원 규모가 11조원으로 가장 크다. 이 업종들 기업에 대한 산업은행의 대출 금리를 최대 1.2%포인트 인하하는 것이 골자다. 시중은행들도 수출 기업에 대한 별도의 금리 우대 상품을 마련하고 총 5조4000억원을 공급하기로 했다. 신수출 판로 개척 지원은 새로운 국가 시장으로 진출하는 중소·중견 기업들에 신용보증기금이 특례보증을 서주거나 은행 대출금리를 최대 1.5%포인트 낮춰주는 혜택 등을 제공하는 것이다. 금융위 관계자는 “이번 추가 지원으로 충분한 규모의 수출 금융을 공급하고, 우리 기업들의 중장기 경쟁력 강화에 기여할 것”이라고 말했다. ⓒ 조선일보 &"
20230816,"금융위원장 ""50년 만기 주택담보대출 급증...나이 제한 검토 중"""," 50년 만기 주택담보대출이 최근 급증하면서 가계대출 증가 요인으로 지목되자 금융당국이 연령 제한을 검토하기로 했습니다. 김주현 금융위원장은 오늘(16일) '수출금융 종합지원 방안' 간담회 이후 기자들과 만나 초장기 주담대에 연령 제한을 두는 방법에 대해 ""공감하며 보고 있다""고 말했습니다. 이어 4월부터 주담대가 증가하고 있는데 어떤 연령대에서 어떤 목적으로 쓰고 있는지 종합적으로 본 뒤 어느 정도까지 용인할지 판단할 수 있다고 설명했습니다. 다만, 아직 규제와 관련해서는 결정된 방향이 없다고 선을 그었습니다. 김 위원장은 또, 가계부채 증가세에 대해 재정을 풀거나 부채로 소비를 유도하는 게 제일 쉬운 방법인데 결국 상환 문제가 남기 때문에 과도하게 부채가 늘어나는 건 좋지 않다고 지적했습니다. 다만 자산소득이 높지 않은 취약계층은 경기회복이 지연되면 연체율이 높아질 수밖에 없는데 갑자기 가계대출을 줄이면 또 어려워져 적정 수준에서 한도를 관리해야 한다고 강조했습니다. 앞서 금융당국은 50년 만기 주담대에 연령 제한을 도입할 경우 청년층 기준이 되는 만 34세 미만으로 한정하는 안을 검토하고 있는 것으로 알려졌습니다. 이번 달 들어 열흘 만에 주담대가 1조 원 이상 늘어나는 등 가계 대출 증가세가 이어지는 가운데, 초장기 주담대가 DSR 규제 우회 수단으로 활용되고 있다는 지적이 나오고 있기 때문입니다. YTN 엄윤주 () [카카오톡] YTN 검색해 채널 추가 [메일] [저작권자(c) YTN 무단전재 및 재배포 금지] "
20230816,"한은, 대출제도 왜 개편했나…금통위원들 ""현 제도 신속 지원 어려워"""," 한국은행, 제14차 금통위 의사록 공개""현행 제도, 유동성 확보 어려움 겪는 기관 지원에 한계""대출담보범위 확대·비은행권 지원 등 고민 담겨  타임톡"
20230816,"60세에 50년만기 대출한 은행들..김주현·이복현 ""이달 중 실태점검"""," (종합)50년만기 대출-인터넷은행 주담대 DSR 우회 실태조사 후 제도개선안 내놓기로  금융위원회 김주현 금융위원장과 이복현 금융감독원장이 최근 은행권을 중심으로 빠르게 늘고 있는 가계대출 관련해 DSR(총부채원리금상환비율)을 편법적으로 우회하고 있는지 집중 점검하겠다고 경고했다. 이달 안에 50년 만기 주택담보대출과 인터넷은행 주담대 등을 중심으로 대출 적정성을 살펴보고 대출연령 제한 등 개선안을 신속히 내놓기로 했다. 김 위원장은 16일 서울 중구 은행회관에서 수출금융 종합지원 방안 간담회를 마치고 기자들과 만나 50년 만기 주담대에 나이제한을 검토하는 것과 관련해 ""아직 결정된 것은 없다""면서도 ""(가계대출이 증가하는) 속도라든가 어떤 연령대에서 어떤 목적으로 대출을 받는지 등을 종합적으로 봐서 어느 정도까지 용인할지 판단을 내릴 것""이라고 밝혔다. 금융당국은 주담대를 중심으로 가계대출이 넉달 연속 증가세를 기록하자 주담대에 만 34세 이하 연령 제한을 두는 방안을 검토 중이다. 50년 만기 주담대가 DSR을 우회하고 있다는 판단에서다. 김 위원장은 간담회에서 ""대출한도를 늘리기 위해 50년 만기 대출이 사용되거나 비대면 주담대에서 소득확인이 제대로 이뤄지지 않고 있다""고 지적했다. 그는 ""일반 상식에 벗어나서 DSR 규제를 우회하는 수단이 없는지, 상환능력이 부족한 분들에게 과잉 대출을 하고 있지 않은지 신중하게 살펴봐달라""고 은행장들에게 당부하기도 했다.  이복현 금융감독원장이 16일 서울 영등포구 금감원에서 열린 금감원·국가수사본부 자본시장 불법행위 대응 및 협력 강화를 위한 업무협약식에서 인사말을 하고 있다. 오른쪽은 우종수 국가수사본부장. 2023.8.16 Copyright (C) 뉴스1. All rights reserved. 무단 전재 및 재배포 금지. 이복현 원장도 같은날 오후 서울 여의도 금감원 본점에서 금감원-국가수사본부 간 업무협약식 이후 가계대출과 관련해 별도의 언론 브리핑을 통해 ""8월 중 가계대출 관리 내지는 실태와 관련해 현장점검을 내보낼 계획""이라며 ""최근 DSR이 과거보다 중요해진 상황에서 주담대 산정과정에서 (DSR을) 적정하게 산정했는지 실태점검 할 것""이라고 말했다. 이 원장은 50년 만기 주담대를 예로 들면서 ""금리가 변동하는 상황에서 50년 후 소득을 어떻게 산정하는지, 50년 후 소득이 없는 상황에서 소득을 과도하게 넘어가게 했는지(보겠다), 그걸 고려하지 않고 DSR을 만들었을 수도 있다""고 진단했다. 그는 ""실질 소득을 넘어서 대출이 일어난다는 것은 뭔가 빠진게 있지 않나 합리적 의심이 가능하다. 그런 차원의 현장점검""이라며 ""실질적으로 DSR이 작동됐는지 집중적으로 볼 것""이라고 강조했다. 예컨대 은행들이 50년 만기 주담대를 판매하는 과정에서 은퇴 직전인 60세 대출의 예상소득을 고려하지 않고 현재 수준의 소득만을 봤는지가 금융당국의 점검 대상이다. 대형 은행 중에선 신한은행만 이런 위험을 가정해 만기가 40년을 넘는 경우 대출자의 연령은 만 34세로 제한했다. 금융당국은 또 올 상반기에만 5조원 넘게 증가한 인터넷은행의 주택담보대출 실태도 들여다 본다. 이 원장은 ""인터넷은행의 태생은 씬파일러(금융거래정보가 부족한 고객)에게 빅데이터를 분석해 자금을 공급하는 것인데 지금은 무분별하게 (주담대로) 집중, 쏠림 현상이 나타나 인터넷은행 제도에 합치되는지 비판적 시각을 갖고 있다""며 ""대출 원칙을 악용하고 있는지, 과도하게 (대출이) 느는 부분이 없는지 현장점검을 하겠다""고 말했다. 금감원은 '속전속결'로 이달 안에 은행권 실태조사를 실시할 계획이다. △은행별로 가계대출 증가요인이 무엇인지 △대출규제인 DSR이나 LTV(담보인정비율)를 준수하고 있는지 △전반적으로 가계대출 위험(리스크) 관리 전략을 세우고 있는지 △여신심사가 적정한지 등을 살펴볼 예정이다. 현장점검 결과를 바탕으로 50년 만기 주담대의 연령제한 등 구체적인 제도 개선안을 내놓기로 했다. mt.co.kr 저작권자 ⓒ '돈이 보이는 리얼타임 뉴스' "
20230816,"이복현 금감원장 ""이달 중 은행 가계대출 현장점검…DSR소득산정 볼 것""","  이복현(왼쪽) 금융감독원장과 우종수 경찰청 국가수사본부장이 16일 서울 여의도 금융감독원에서 자본시장 불법행위 대응·협력 강화를 위한 업무협약식을 마치고 기념촬영하고 있다. [금융감독원 제공] 이복현 금융감독원장은 16일 가계대출 및 주택담보대출 증가세와 관련해 “8월 중 가계대출 관리와 관련해 현장점검을 내보낼 계획”이라고 밝혔다.들과 만나 이같이 말했다. 김주현 금융위원장이 이날 오전 은행권에 총부채원리금상환비율(DSR) 규제를 우회한 과잉 대출에 대한 점검을 주문한 데 이어 ‘경고 메시지’를 보낸 것이다. 이 원장은 “최근 가계대출 증가세는 여전히 관리 가능한 범위 내에 있다고 판단하고 있다”며 “정부 출범 이후 1년여간 가계대출 관리의 대원칙인 국내총생산(GDP) 대비 가계부채 수준 등이 감소세를 유지해 왔다”고 설명했다. 그러나 가계부채의 질 관리에 중요한 DSR 규제와 관련해서는 은행의 차주 소득 산정이 적정하게 이뤄지고 있는지 점검이 필요한 시점이 됐다고 지적했다. 이 원장은 “LTV(주택담보대출비율) 규제를 완화하면서 DSR 관리가 더욱 중요해졌다”며 “은행들이 주담대 실행 과정에서 소득 산정을 적정하게 하고 있는지 실태를 점검할 것이고, 인터넷은행의 경우 주담대를 중심으로 한 가격경쟁 촉발이라는 긍정적 측면도 있지만 가파른 상승 추세를 보면 DSR 원칙이 잘 지켜지고 있는지 볼 필요가 있다”고 강조했다. 특히 이 원장은 김 위원장이 지적한 50년 만기 주담대에 대해서도 “변동금리 베이스로 대출이 많이 나가는 상황에서 향후 금리가 올라가는 등 특정한 환경을 상정한 스트레스테스트, 시뮬레이션을 통해 소득을 과도하게 넘어가는 범위까지 고려하고 DSR을 운영하고 있는지 점검해 볼 필요가 있다”고 콕 집어 말했다. 또 최근 증가세로 전환한 은행권 신용대출과 관련해서는 “현장점검을 통해 실제로 나간 돈들이 부동산시장, 자본시장, 생계비 등 어느 분야에서 쓰였는지를 보게 될 것”이라며 “실질적으로 어떻게 분포됐는지 점검을 해야 그에 맞게 대책을 내놓을 수 있을 것이기 때문에 신속하게 점검하겠다”고 말했다. 그러면서 “신속히 현장점검을 진행하고 현장점검 결과를 토대로 50년 만기 주담대를 비롯해 가계대출과 관련한 여러가지 정책에 반영할 부분을 챙겨볼 것”이라며 “하반기 내지는 내년 가계대출 관리의 기준이 될 것”이라고 덧붙였다. 이 원장은 금융당국의 대출금리 인하 압박으로 통화정책 효과가 반감된다는 한국은행 금융통화위원회 의사록 내용과 관련해서는 “통화당국 입장에서는 그렇게 생각할 수 있고 공감가는 부분도 있다”면서도 취약차주와 가계를 보호하기 위한 불가피한 방안이었다고 항변했다. 그는 “미국 같은 경우에는 고정금리 비중이 높으니 금리변동 리스크를 은행들이 떠안지만, 우리는 그 리스크를 차주들이 떠안고 있다. 과도한 변동금리로 인한 부작용이 가계해체 등 폭력적인 방법으로 표출되고 있다”며 “거시정책으로서의 금리인상에 대해서는 물가관리 차원에서 동감하지만, 미시적 개입도 필요하다고 믿고 있다”고 강조했다. ⓒ 헤럴드경제 & heraldbiz.com, 무단 전재 및 재배포 금지 "
